{
  "$schema": "https://json-schema.org/draft/2020-12/schema",
  "$id": "https://contracts.hermes.local/cloud/payloads/session-catalog-snapshot-page-v1.schema.json",
  "title": "Hermes Session Catalog Snapshot Page v1",
  "type": "object",
  "additionalProperties": false,
  "required": [
    "profile",
    "runtime_generation",
    "snapshot_id",
    "catalog_revision",
    "page_index",
    "is_last",
    "sessions"
  ],
  "properties": {
    "profile": {
      "type": "string",
      "minLength": 1,
      "maxLength": 128,
      "pattern": "^(?![\\s\\S]*[^A-Za-z0-9_.-])[A-Za-z0-9_.-]+$"
    },
    "runtime_generation": {
      "type": "string",
      "minLength": 1,
      "maxLength": 128
    },
    "snapshot_id": {
      "type": "string",
      "format": "uuid",
      "pattern": "^[0-9a-f]{8}-[0-9a-f]{4}-[1-5][0-9a-f]{3}-[89ab][0-9a-f]{3}-[0-9a-f]{12}$"
    },
    "catalog_revision": {
      "type": "integer",
      "minimum": 0,
      "maximum": 9007199254740991
    },
    "page_index": {
      "type": "integer",
      "minimum": 0,
      "maximum": 9007199254740991
    },
    "is_last": {
      "type": "boolean"
    },
    "sessions": {
      "type": "array",
      "maxItems": 128,
      "items": {
        "$ref": "https://contracts.hermes.local/session-catalog-entry-v1.schema.json"
      }
    },
    "extensions": {
      "type": "object",
      "maxProperties": 16,
      "propertyNames": {
        "pattern": "^[a-z][a-z0-9]*(\\.[a-z0-9][a-z0-9-]*)+$"
      },
      "additionalProperties": {
        "type": "object"
      }
    }
  },
  "allOf": [
    {
      "if": {
        "properties": {
          "is_last": {
            "const": false
          }
        },
        "required": [
          "is_last"
        ]
      },
      "then": {
        "properties": {
          "sessions": {
            "minItems": 1
          }
        }
      }
    }
  ]
}
