{
  "profile": "default",
  "runtime_generation": "runtime-20260803-01",
  "snapshot_id": "11111111-1111-4111-8111-111111111111",
  "catalog_revision": 7,
  "page_index": 0,
  "is_last": true,
  "sessions": [
    {
      "session_key": "durable-session-real",
      "surface": "gateway",
      "authority_revision": 3,
      "available_actions": [
        "approval.respond",
        "clarify.respond",
        "prompt.submit",
        "session.interrupt",
        "session.steer"
      ]
    }
  ]
}
